{
  "$schema": "https://raw.githubusercontent.com/NSXBet/admin/main/packages/admin-sdk/schemas/admin.module.schema.json",
  "id": "@admin/e2ai",
  "title": {
    "en-US": "QA Runs",
    "pt-BR": "Execuções de QA",
    "es": "Ejecuciones de QA",
    "ro": "Rulări QA"
  },
  "description": {
    "en-US": "E2AI — deterministic e2e QA runs for bet-app web: runs, verdicts and live reports.",
    "pt-BR": "E2AI — execuções de QA determinísticas do bet-app web: runs, vereditos e relatórios.",
    "es": "E2AI — ejecuciones de QA deterministas de bet-app web: runs, veredictos e informes.",
    "ro": "E2AI — rulări QA deterministe pentru bet-app web: rulări, verdicte și rapoarte."
  },
  "routeBase": "/e2ai",
  "category": "Quality",
  "icon": "shield-check",
  "keywords": [
    "qa",
    "e2e",
    "playwright",
    "runs",
    "verdict",
    "report"
  ],
  "navigationOrder": 50,
  "navigation": {
    "style": "stacked",
    "sections": [
      {
        "id": "operations",
        "label": {
          "en-US": "Operations",
          "pt-BR": "Operações",
          "es": "Operaciones",
          "ro": "Operațiuni"
        }
      }
    ]
  },
  "commands": [
    {
      "id": "runs",
      "title": {
        "en-US": "Runs",
        "pt-BR": "Execuções",
        "es": "Ejecuciones",
        "ro": "Rulări"
      },
      "route": "/e2ai/runs",
      "icon": "list",
      "section": "operations",
      "keywords": [
        "runs",
        "e2e",
        "playwright",
        "verdict"
      ]
    },
    {
      "id": "plans",
      "title": {
        "en-US": "Test Plans",
        "pt-BR": "Planos de Teste",
        "es": "Planes de Prueba",
        "ro": "Planuri de Test"
      },
      "route": "/e2ai/plans",
      "icon": "file-text",
      "section": "operations",
      "keywords": [
        "plans",
        "test plans",
        "steps",
        "sync"
      ]
    },
    {
      "id": "approvals",
      "title": {
        "en-US": "Approvals",
        "pt-BR": "Aprovações",
        "es": "Aprobaciones",
        "ro": "Aprobări"
      },
      "route": "/e2ai/approvals",
      "icon": "check-circle",
      "section": "operations",
      "keywords": [
        "approvals",
        "queue",
        "approve",
        "reject",
        "pending"
      ]
    },
    {
      "id": "corpus",
      "title": {
        "en-US": "Behavior Corpus",
        "pt-BR": "Corpus de Comportamentos",
        "es": "Corpus de Comportamientos",
        "ro": "Corpus de Comportamente"
      },
      "route": "/e2ai/corpus",
      "icon": "database",
      "section": "operations",
      "keywords": [
        "corpus",
        "behaviors",
        "learnings",
        "playwright"
      ]
    },
    {
      "id": "quality",
      "title": {
        "en-US": "Flakes & Quarantine",
        "pt-BR": "Flakes e Quarentena",
        "es": "Flakes y Cuarentena",
        "ro": "Flakes și Carantină"
      },
      "route": "/e2ai/quality",
      "icon": "shield",
      "section": "operations",
      "keywords": [
        "flakes",
        "quarantine",
        "flaky tests",
        "rate"
      ]
    },
    {
      "id": "trends",
      "title": {
        "en-US": "Trends",
        "pt-BR": "Tendências",
        "es": "Tendencias",
        "ro": "Tendințe"
      },
      "route": "/e2ai/trends",
      "icon": "trending-up",
      "section": "operations",
      "keywords": [
        "trends",
        "flip rate",
        "history",
        "cost",
        "alerts"
      ]
    },
    {
      "id": "corpus-health",
      "title": {
        "en-US": "Corpus Health",
        "pt-BR": "Saúde do Corpus",
        "es": "Salud del Corpus",
        "ro": "Starea Corpusului"
      },
      "route": "/e2ai/corpus-health",
      "icon": "activity",
      "section": "operations",
      "keywords": [
        "corpus health",
        "stale",
        "promotion queue",
        "learnings"
      ]
    }
  ],
  "permissions": {
    "view": [
      "admin.e2ai.view"
    ]
  },
  "owners": {
    "team": "QA Engineering",
    "supportChannel": "#qa-engineering"
  }
}
